OBJECTID,naicssix,DESC_,steelhead,naics2,remi70,US2detailed,sixcat
999,812191,DIET AND WEIGHT REDUCING CENTERS,serv_pers,81,64,svc_per,HEREEMPN
1000,812199,OTHER PERSONAL CARE SERVICES,serv_pers,81,64,svc_per,HEREEMPN
1001,812210,FUNERAL HOMES AND FUNERAL SERVICES,serv_pers,81,64,svc_per,HEREEMPN
1002,812220,CEMETERIES AND CREMATORIES,serv_pers,81,64,svc_per,HEREEMPN
1003,812310,COIN-OPERATED LAUNDRIES AND DRYCLEANERS,serv_pers,81,64,svc_per,HEREEMPN
1004,812320,DRY-CLEANING AND LAUNDRY SERVICES (EXCEPT COIN-OPERATED),serv_pers,81,64,svc_per,HEREEMPN
1005,812331,LINEN SUPPLY,serv_pers,81,64,svc_per,HEREEMPN
1006,812332,INDUSTRIAL LAUNDERERS,serv_pers,81,64,svc_per,HEREEMPN
1007,812910,PET CARE (EXCEPT VETERINARY) SERVICES,serv_pers,81,64,svc_per,HEREEMPN
1008,812921,PHOTOFINISHING LABORATORIES (EXCEPT ONE-HOUR),serv_pers,81,64,svc_per,HEREEMPN
1009,812930,PARKING LOTS AND GARAGES,serv_pers,81,64,svc_per,HEREEMPN
1010,812990,ALL OTHER PERSONAL SERVICES,serv_pers,81,64,svc_per,HEREEMPN
1011,813110,RELIGIOUS ORGANIZATIONS,serv_pers,81,65,svc_per,HEREEMPN
1012,813211,GRANTMAKING FOUNDATIONS,serv_pers,81,65,svc_per,HEREEMPN
1013,813212,VOLUNTARY HEALTH ORGANIZATIONS,serv_pers,81,65,svc_per,HEREEMPN
1014,813219,OTHER GRANTMAKING AND GIVING SERVICES,serv_pers,81,65,svc_per,HEREEMPN
1015,813311,GRANTS MORE,serv_pers,81,65,svc_per,HEREEMPN
1016,813312,"ENVIRONMENT, CONSERVATION, AND WILDLIFE ORGANIZATIONS",serv_pers,81,65,svc_per,HEREEMPN
1017,813319,OTHER SOCIAL ADVOCACY ORGANIZATIONS,serv_pers,81,65,svc_per,HEREEMPN
1018,813410,CIVIC AND SOCIAL ORGANIZATIONS,serv_pers,81,65,svc_per,HEREEMPN
1019,813910,BUSINESS ASSOCIATIONS,serv_pers,81,65,svc_per,HEREEMPN
1020,813920,PROFESSIONAL ORGANIZATIONS,serv_pers,81,65,svc_per,HEREEMPN
1021,813930,LABOR UNIONS AND SIMILAR LABOR ORGANIZATIONS,serv_pers,81,65,svc_per,HEREEMPN
1022,813940,POLITICAL ORGANIZATIONS,serv_pers,81,65,svc_per,HEREEMPN
1023,813990,"OTHER SIMILAR ORGANIZATIONS (EXCEPT BUSINESS, PROFESSIONAL, LABOR, AND POLITICAL ORGANIZATIONS)",serv_pers,81,65,svc_per,HEREEMPN
1024,921110,EXECUTIVE OFFICES,gov,92,6768,gov,OTHEMPN
1025,921120,LEGISLATIVE BODIES,gov,92,6768,gov,OTHEMPN
1026,921130,PUBLIC FINANCE,gov,92,6768,gov,OTHEMPN
1027,921140,"EXECUTIVE AND LEGISLATIVE OFFICES, COMBINED",gov,92,6768,gov,OTHEMPN
1028,921150,AMERICAN INDIAN AND ALASKA NATIVE TRIBAL GOVERNMENTS,gov,92,6768,gov,OTHEMPN
1029,921190,ALL OTHER GENERAL GOVERNMENT,gov,92,6768,gov,OTHEMPN
1030,922110,COURTS,gov,92,6768,gov,OTHEMPN
1031,922120,POLICE PROTECTION,gov,92,6768,gov,OTHEMPN
1032,922130,LEGAL COUNSEL AND PROSECUTION,gov,92,6768,gov,OTHEMPN
1033,922140,CORRECTIONAL INSTITUTIONS,gov,92,6768,gov,OTHEMPN
1034,922150,PAROLE OFFICES AND PROBATION OFFICES,gov,92,6768,gov,OTHEMPN
1035,922160,FIRE PROTECTION,gov,92,6768,gov,OTHEMPN
1036,922190,"ALL OTHER JUSTICE, PUBLIC ORDER, AND SAFETY",gov,92,6768,gov,OTHEMPN
1037,923110,ADMINISTRATION OF EDUCATION PROGRAMS,gov,92,6768,gov,OTHEMPN
1038,923120,ADMINISTRATION OF PUBLIC HEALTH PROGRAMS,gov,92,6768,gov,OTHEMPN
1039,923130,"ADMINISTRATION OF SOCIAL, HUMAN RESOURCE AND INCOME MAINTENANCE PROGRAMS",gov,92,6768,gov,OTHEMPN
1040,923140,ADMINISTRATION OF VETERAN'S AFFAIRS,gov,92,6768,gov,OTHEMPN
1041,924110,AIR AND WATER RESOURCE AND SOLID WASTE MANAGEMENT,gov,92,6768,gov,OTHEMPN
1042,924120,"LAND, MINERAL, WILDLIFE, AND FOREST CONSERVATION",gov,92,6768,gov,OTHEMPN
1043,925110,ADMINISTRATION OF HOUSING PROGRAMS,gov,92,6768,gov,OTHEMPN
1044,925120,ADMINISTRATION OF URBAN PLANNING AND COMMUNITY AND RURAL DEVELOPMENT,gov,92,6768,gov,OTHEMPN
1045,926110,ADMINISTRATION OF GENERAL ECONOMIC PROGRAMS,gov,92,6768,gov,OTHEMPN
1046,926120,REGULATION AND ADMINISTRATION OF TRANSPORTATION PROGRAMS,gov,92,6768,gov,OTHEMPN
1047,926130,"REGULATION AND ADMINISTRATION OF COMMUNICATIONS, ELECTRIC, GAS, AND OTHER UTILITIES",gov,92,6768,gov,OTHEMPN
1048,926140,REGULATION OF AGRICULTURAL MARKETING AND COMMODITY,gov,92,6768,gov,OTHEMPN
1049,926150,"REGULATION, LICENSING, AND INSPECTION OF MISCELLANEOUS COMMERCIAL SECTORS",gov,92,6768,gov,OTHEMPN
1050,927110,SPACE RESEARCH AND TECHNOLOGY,gov,92,6768,gov,OTHEMPN
1051,928110,NATIONAL SECURITY,gov,92,6768,gov,OTHEMPN
1052,928120,INTERNATIONAL AFFAIRS,gov,92,6768,gov,OTHEMPN
1053,999990,MISSING,mis,0,0,mis,MISSING
