OBJECTID,naicssix,DESC_,steelhead,naics2,remi70,US2detailed,sixcat
1,111110,SOYBEAN FARMING,ag,11,70,agnat,AGREMPN
2,111120,OILSEED (EXCEPT SOYBEAN) FARMING,ag,11,70,agnat,AGREMPN
3,111130,DRY PEA AND BEAN FARMING,ag,11,70,agnat,AGREMPN
4,111140,WHEAT FARMING,ag,11,70,agnat,AGREMPN
5,111150,CORN FARMING,ag,11,70,agnat,AGREMPN
6,111160,RICE FARMING,ag,11,70,agnat,AGREMPN
7,111199,ALL OTHER GRAIN FARMING,ag,11,70,agnat,AGREMPN
8,111211,POTATO FARMING,ag,11,70,agnat,AGREMPN
9,111219,OTHER VEGETABLE (EXCEPT POTATO) AND MELON FARMING,ag,11,70,agnat,AGREMPN
10,111310,ORANGE GROVES,ag,11,70,agnat,AGREMPN
11,111320,CITRUS (EXCEPT ORANGE) GROVES,ag,11,70,agnat,AGREMPN
12,111331,APPLE ORCHARDS,ag,11,70,agnat,AGREMPN
13,111332,GRAPE VINEYARDS,ag,11,70,agnat,AGREMPN
14,111333,STRAWBERRY FARMING,ag,11,70,agnat,AGREMPN
15,111334,BERRY (EXCEPT STRAWBERRY) FARMING,ag,11,70,agnat,AGREMPN
16,111335,TREE NUT FARMING,ag,11,70,agnat,AGREMPN
17,111336,FRUIT AND TREE NET COMBINATION FARMING,ag,11,70,agnat,AGREMPN
18,111339,OTHER NONCITRUS FRUIT FARMING,ag,11,70,agnat,AGREMPN
19,111411,MUSHROOM PRODUCTION,ag,11,70,agnat,AGREMPN
20,111419,OTHER FOOD CROPS GROWN UNDER COVER,ag,11,70,agnat,AGREMPN
21,111421,NURSERY AND TREE PRODUCTION,ag,11,70,agnat,AGREMPN
22,111422,FLORICULTURE PRODUCTION,ag,11,70,agnat,AGREMPN
23,111910,TOBACCO FARMING,ag,11,70,agnat,AGREMPN
24,111920,COTTON FARMING,ag,11,70,agnat,AGREMPN
25,111930,SUGARCANE FARMING,ag,11,70,agnat,AGREMPN
26,111940,HAY FARMING,ag,11,70,agnat,AGREMPN
27,111991,SUGAR BEET FARMING,ag,11,70,agnat,AGREMPN
28,111992,PEANUT FARMING,ag,11,70,agnat,AGREMPN
29,111998,ALL OTHER MISCELLANEOUS CROP FARMING,ag,11,70,agnat,AGREMPN
30,112111,BEEF CATTLE RANCHING AND FARMING,ag,11,70,agnat,AGREMPN
31,112112,CATTLE FEEDLOTS,ag,11,70,agnat,AGREMPN
32,112120,DAIRY CATTLE AND MILK PRODUCTION,ag,11,70,agnat,AGREMPN
33,112210,HOG AND PIG FARMING,ag,11,70,agnat,AGREMPN
34,112310,CHICKEN EGG PRODUCTION,ag,11,70,agnat,AGREMPN
35,112320,BROILERS AND OTHER MEAT-TYPE CHICKEN PRODUCTION,ag,11,70,agnat,AGREMPN
36,112330,TURKEY PRODUCTION,ag,11,70,agnat,AGREMPN
37,112340,POULTRY HATCHERIES,ag,11,70,agnat,AGREMPN
38,112390,OTHER POULTRY PRODUCTION,ag,11,70,agnat,AGREMPN
39,112410,SHEEP FARMING,ag,11,70,agnat,AGREMPN
40,112420,GOAT FARMING,ag,11,70,agnat,AGREMPN
41,112511,FINFISH FARMING AND FISH HATCHERIES,ag,11,70,agnat,AGREMPN
42,112512,SHELLFISH FARMING,ag,11,70,agnat,AGREMPN
43,112519,OTHER AQUACULTURE,ag,11,70,agnat,AGREMPN
44,112910,APICULTURE,ag,11,70,agnat,AGREMPN
45,112920,HORSE AND OTHER EQUINE PRODUCTION,ag,11,70,agnat,AGREMPN
46,112930,FUR-BEARING ANIMAL AND RABBIT PRODUCTION,ag,11,70,agnat,AGREMPN
47,112990,ALL OTHER ANIMAL PRODUCTION,ag,11,70,agnat,AGREMPN
48,113110,TIMBER TRACT OPERATIONS,ag,11,1,agnat,AGREMPN
49,113210,FOREST NURSERIES AND GATHERING OF FOREST PRODUCTS,ag,11,1,agnat,AGREMPN
50,113310,LOGGING,ag,11,1,agnat,AGREMPN
51,114111,FINFISH FISHING,ag,11,1,agnat,AGREMPN
52,114112,SHELLFISH FISHING,ag,11,1,agnat,AGREMPN
53,114119,OTHER MARINE FISHING,ag,11,1,agnat,AGREMPN
54,114210,HUNTING AND TRAPPING,ag,11,1,agnat,AGREMPN
55,115111,COTTON GINNING,ag,11,2,agnat,AGREMPN
56,115112,"SOIL PREPARATION, PLANTING AND CULTIVATING",ag,11,2,agnat,AGREMPN
57,115113,"CROP HARVESTING, PRIMARILY BY MACHINE",ag,11,2,agnat,AGREMPN
58,115114,POSTHARVEST CROP ACTIVITIES (EXCEPT COTTON GINNING),ag,11,2,agnat,AGREMPN
59,115115,FARM LABOR CONTRACTORS AND CREW LEADERS,ag,11,2,agnat,AGREMPN
60,115116,FARM MANAGEMENT SERVICES,ag,11,2,agnat,AGREMPN
61,115210,SUPPORT ACTIVITIES FOR ANIMAL PRODUCTION,ag,11,2,agnat,AGREMPN
62,115310,SUPPORT ACTIVITIES FOR FORESTRY,ag,11,2,agnat,AGREMPN
63,211111,CRUDE PETROLEUM AND NATURAL GAS EXTRACTION,natres,21,3,agnat,AGREMPN
64,211112,NATURAL GAS LIQUID EXTRACTION,natres,21,3,agnat,AGREMPN
65,212111,BITUMINOUS COAL AND LIGNITE SURFACE MINING,natres,21,4,agnat,AGREMPN
66,212112,BITUMINOUS COAL UNDERGROUND MINING,natres,21,4,agnat,AGREMPN
67,212113,ANTHRACITE MINING,natres,21,4,agnat,AGREMPN
68,212210,IRON ORE MINING,natres,21,4,agnat,AGREMPN
69,212221,GOLD ORE MINING,natres,21,4,agnat,AGREMPN
70,212222,SILVER ORE MINING,natres,21,4,agnat,AGREMPN
71,212231,LEAD ORE AND ZINC ORE MINING,natres,21,4,agnat,AGREMPN
72,212234,COPPER ORE AND NICKEL ORE MINING,natres,21,4,agnat,AGREMPN
73,212291,URANIUM-RADIUM-VANADIUM ORE MINING,natres,21,4,agnat,AGREMPN
74,212299,OTHER METAL ORE MINING,natres,21,4,agnat,AGREMPN
75,212311,DIMENSION STONE MINING AND QUARRY,natres,21,4,agnat,AGREMPN
76,212312,CRUSHED AND BROKEN LIMESTONE MINING AND QUARRYING,natres,21,4,agnat,AGREMPN
77,212313,CRUSHED AND BROKEN GRANITE MINING AND QUARRYING,natres,21,4,agnat,AGREMPN
78,212319,OTHER CRUSHED AND BROKEN STONE MINING AND QUARRYING,natres,21,4,agnat,AGREMPN
79,212321,CONSTRUCTION SAND AND GRAVEL MINING,natres,21,4,agnat,AGREMPN
80,212322,INDUSTRIAL SAND MINING,natres,21,4,agnat,AGREMPN
81,212324,KAOLIN AND BALL CLAY MINING,natres,21,4,agnat,AGREMPN
82,212325,CLAY AND CERAMIC AND REFRACTORY MINERALS MINING,natres,21,4,agnat,AGREMPN
83,212391,"POTASH, SODA, AND BORATE MINERAL MINING",natres,21,4,agnat,AGREMPN
84,212392,PHOSPHATE ROCK MINING,natres,21,4,agnat,AGREMPN
85,212393,OTHER CHEMICAL AND FERTILIZER MINERAL MINING,natres,21,4,agnat,AGREMPN
86,212399,ALL OTHER NON-METALLIC MINERAL MINING,natres,21,4,agnat,AGREMPN
87,213111,DRILLING OIL AND GAS WELLS,natres,21,5,agnat,AGREMPN
88,213112,SUPPORT ACTIVITIES FOR OIL AND GAS FIELD OPERATIONS,natres,21,5,agnat,AGREMPN
89,213113,SUPPORT ACTIVITIES FOR COAL MINING,natres,21,5,agnat,AGREMPN
90,213114,SUPPORT ACTIVITIES FOR METAL MINING,natres,21,5,agnat,AGREMPN
91,213115,"SUPPORT ACTIVITIES FOR NON-METALLIC MINERALS, (EXCEPT FUELS)",natres,21,5,agnat,AGREMPN
92,221111,HYDRO ELECTRIC POWER GENERATION,util,22,6,util,MWTEMPN
93,221112,FOSSIL FUEL ELECTRIC POWER GENERATION,util,22,6,util,MWTEMPN
94,221113,NUCLEAR ELECTRIC POWER GENERATION,util,22,6,util,MWTEMPN
95,221115,"ELECTRIC POWER GENERATION, WIND",util,22,6,util,MWTEMPN
96,221118,OTHER ELECTRIC POWER GENERATION,util,22,6,util,MWTEMPN
97,221121,ELECTRIC BULK POWER TRANSMISSION AND CONTROL,util,22,6,util,MWTEMPN
98,221122,ELECTRIC POWER DISTRIBUTION,util,22,6,util,MWTEMPN
99,221210,NATURAL GAS DISTRIBUTION,util,22,6,util,MWTEMPN
100,221310,WATER SUPPLY AND IRRIGATION SYSTEMS,util,22,6,util,MWTEMPN
101,221320,SEWAGE TREATMENT FACILITIES,util,22,6,util,MWTEMPN
102,221330,STEAM AND AIR-CONDITIONING SUPPLY,util,22,6,util,MWTEMPN
103,236115,NEW SINGLE-FAMILY HOUSING CONSTRUCTION (EXCEPT FOR-SALE BUILDERS),constr,23,7,constr,OTHEMPN
104,236116,NEW MULTIFAMILY HOUSING CONSTRUCTION (EXCEPT FOR-SALE BUILDERS),constr,23,7,constr,OTHEMPN
105,236117,NEW HOUSING FOR-SALE BUILDERS,constr,23,7,constr,OTHEMPN
106,236118,RESIDENTIAL REMODELERS,constr,23,7,constr,OTHEMPN
107,236210,INDUSTRIAL BUILDING CONSTRUCTION,constr,23,7,constr,OTHEMPN
108,236220,COMMERCIAL AND INSTITUTIONAL BUILDING CONSTRUCTION,constr,23,7,constr,OTHEMPN
109,237110,WATER AND SEWER LINE AND RELATED STRUCTURES CONSTRUCTION,constr,23,7,constr,OTHEMPN
110,237120,OIL AND GAS PIPELINE AND RELATED STRUCTURES CONSTRUCTION,constr,23,7,constr,OTHEMPN
111,237130,POWER AND COMMUNICATION LINE AND RELATED STRUCTURES CONSTRUCTION,constr,23,7,constr,OTHEMPN
112,237210,LAND SUBDIVISION,constr,23,7,constr,OTHEMPN
113,237310,"HIGHWAY, STREET AND BRIDGE CONSTRUCTION",constr,23,7,constr,OTHEMPN
114,237990,OTHER HEAVY AND CIVIL ENGINEERING CONSTRUCTION,constr,23,7,constr,OTHEMPN
115,238110,POURED CONCRETE FOUNDATION AND STRUCTURE CONTRACTORS,constr,23,7,constr,OTHEMPN
116,238120,STRUCTURAL STEEL AND PRECAST CONCRETE CONTRACTORS,constr,23,7,constr,OTHEMPN
117,238130,FRAMING CONTRACTORS,constr,23,7,constr,OTHEMPN
118,238140,MASONRY CONTRACTORS,constr,23,7,constr,OTHEMPN
119,238150,GLASS AND GLAZING CONTRACTORS,constr,23,7,constr,OTHEMPN
120,238160,ROOFING CONTRACTORS,constr,23,7,constr,OTHEMPN
121,238170,SIDING CONTRACTORS,constr,23,7,constr,OTHEMPN
122,238190,"OTHER FOUNDATION, STRUCTURE, AND BUILDING EXTERIOR CONTRACTORS",constr,23,7,constr,OTHEMPN
123,238210,ELECTRICAL CONTRACTORS,constr,23,7,constr,OTHEMPN
124,238220,"PLUMBING, HEATING AND AIR-CONDITIONING CONTRACTORS",constr,23,7,constr,OTHEMPN
125,238290,OTHER BUILDING EQUIPMENT CONTRACTORS,constr,23,7,constr,OTHEMPN
126,238310,DRYWALL AND INSULATION CONTRACTORS,constr,23,7,constr,OTHEMPN
127,238320,PAINTING AND WALL COVERING CONTRACTORS,constr,23,7,constr,OTHEMPN
128,238330,FLOORING CONTRACTORS,constr,23,7,constr,OTHEMPN
129,238340,TILE AND TERRAZZO AND TILE CONTRACTORS,constr,23,7,constr,OTHEMPN
130,238350,FINISH CARPENTRY CONTACTORS,constr,23,7,constr,OTHEMPN
131,238390,OTHER BUILDING FINISHING CONTRACTORS,constr,23,7,constr,OTHEMPN
132,238910,SITE PREPARATION CONTRACTORS,constr,23,7,constr,OTHEMPN
133,238990,ALL OTHER SPECIALTY TRADE CONTRACTORS,constr,23,7,constr,OTHEMPN
134,311111,DOG AND CAT FOOD MANUFACTURING,man_lgt,3133,19,man_lgt,MWTEMPN
135,311119,OTHER ANIMAL FOOD MANUFACTURING,man_lgt,3133,19,man_lgt,MWTEMPN
136,311211,FLOUR MILLING,man_lgt,3133,19,man_lgt,MWTEMPN
137,311212,RICE MILLING,man_lgt,3133,19,man_lgt,MWTEMPN
138,311213,MALT MANUFACTURING,man_lgt,3133,19,man_lgt,MWTEMPN
139,311221,WET CORN MILLING,man_lgt,3133,19,man_lgt,MWTEMPN
140,311224,SOYBEAN AND OTHER OILSEED PROCESSING,man_lgt,3133,19,man_lgt,MWTEMPN
141,311225,FATS AND OILS REFINING AND BLENDING,man_lgt,3133,19,man_lgt,MWTEMPN
142,311230,BREAKFAST CEREAL MANUFACTURING,man_lgt,3133,19,man_lgt,MWTEMPN
143,311313,BEET SUGAR MANUFACTURING,man_lgt,3133,19,man_lgt,MWTEMPN
144,311314,CANE SUGAR MANUFACTURING,man_lgt,3133,19,man_lgt,MWTEMPN
145,311340,NONCHOCOLATE CONFECTIONERY MANUFACTURING,man_lgt,3133,19,man_lgt,MWTEMPN
146,311351,CHOCOLATE AND CONFECTIONERY MANUFACTURING FROM CACAO BEANS,man_lgt,3133,19,man_lgt,MWTEMPN
147,311352,CONFECTIONERY MANUFACTURING FROM PURCHASED CHOCOLATE,man_lgt,3133,19,man_lgt,MWTEMPN
148,311411,"FROZEN FRUIT, JUICE, AND VEGETABLE PROCESSING",man_lgt,3133,19,man_lgt,MWTEMPN
149,311412,FROZEN SPECIALTY FOOD MANUFACTURING,man_lgt,3133,19,man_lgt,MWTEMPN
150,311421,FRUIT AND VEGETABLE CANNING,man_lgt,3133,19,man_lgt,MWTEMPN
151,311422,SPECIALTY CANNING,man_lgt,3133,19,man_lgt,MWTEMPN
152,311423,DRIED AND DEHYDRATED FOOD MANUFACTURING,man_lgt,3133,19,man_lgt,MWTEMPN
153,311511,FLUID MILK MANUFACTURING,man_lgt,3133,19,man_lgt,MWTEMPN
154,311512,CREAMERY BUTTER MANUFACTURING,man_lgt,3133,19,man_lgt,MWTEMPN
155,311513,CHEESE MANUFACTURING,man_lgt,3133,19,man_lgt,MWTEMPN
156,311514,"DRY, CONDENSED, AND EVAPORATED DAIRY PRODUCT MANUFACTURING",man_lgt,3133,19,man_lgt,MWTEMPN
157,311520,ICE CREAM AND FROZEN DESSERT MANUFACTURING,man_lgt,3133,19,man_lgt,MWTEMPN
158,311611,ANIMAL (EXCEPT POULTRY) SLAUGHTERING,man_lgt,3133,19,man_lgt,MWTEMPN
159,311612,MEAT PROCESSED FROM CARCASSES,man_lgt,3133,19,man_lgt,MWTEMPN
160,311613,RENDERING AND MEAT BYPRODUCT PROCESSING,man_lgt,3133,19,man_lgt,MWTEMPN
161,311615,POULTRY PROCESSING,man_lgt,3133,19,man_lgt,MWTEMPN
162,311710,SEAFOOD PRODUCT PREPARATION AND PACKAGING,man_lgt,3133,19,man_lgt,MWTEMPN
163,311811,RETAIL BAKERIES,man_lgt,3133,19,man_lgt,MWTEMPN
164,311812,COMMERCIAL BAKERIES,man_lgt,3133,19,man_lgt,MWTEMPN
165,311813,FROZEN BAKERY PRODUCT MANUFACTURING,man_lgt,3133,19,man_lgt,MWTEMPN
166,311821,COOKIE AND CRACKER MANUFACTURING,man_lgt,3133,19,man_lgt,MWTEMPN
167,311824,"DRY PASTA, DOUGH, AND FLOUR MIXES MANUFACTURING FROM PURCHASED FLOUR",man_lgt,3133,19,man_lgt,MWTEMPN
168,311830,TORTILLA MANUFACTURING,man_lgt,3133,19,man_lgt,MWTEMPN
169,311911,ROASTED NUTS AND PEANUT BUTTER MANUFACTURING,man_lgt,3133,19,man_lgt,MWTEMPN
170,311919,OTHER SNACK FOOD MANUFACTURING,man_lgt,3133,19,man_lgt,MWTEMPN
171,311920,COFFEE AND TEA MANUFACTURING,man_lgt,3133,19,man_lgt,MWTEMPN
172,311930,FLAVORING SYRUP AND CONCENTRATE MANUFACTURING,man_lgt,3133,19,man_lgt,MWTEMPN
173,311941,"MAYONNAISE, DRESSING, AND OTHER PREPARED SAUCE MANUFACTURING",man_lgt,3133,19,man_lgt,MWTEMPN
174,311942,SPICE AND EXTRACT MANUFACTURING,man_lgt,3133,19,man_lgt,MWTEMPN
175,311991,PERISHABLE PREPARED FOOD MANUFACTURING,man_lgt,3133,19,man_lgt,MWTEMPN
176,311999,ALL OTHER MISCELLANEOUS FOOD MANUFACTURING,man_lgt,3133,19,man_lgt,MWTEMPN
177,312111,SOFT DRINK MANUFACTURING,man_lgt,3133,20,man_lgt,MWTEMPN
178,312112,BOTTLED WATER MANUFACTURING,man_lgt,3133,20,man_lgt,MWTEMPN
179,312113,ICE MANUFACTURING,man_lgt,3133,20,man_lgt,MWTEMPN
180,312120,BREWERIES,man_lgt,3133,20,man_lgt,MWTEMPN
181,312130,WINERIES,man_lgt,3133,20,man_lgt,MWTEMPN
182,312140,DISTILLERIES,man_lgt,3133,20,man_lgt,MWTEMPN
183,312230,TOBACCO MANUFACTURING,man_lgt,3133,20,man_lgt,MWTEMPN
184,313110,"FIBER, YARN, AND THREAD MILLS",man_lgt,3133,21,man_lgt,MWTEMPN
185,313210,BROADWOVEN FABRIC MILLS,man_lgt,3133,21,man_lgt,MWTEMPN
186,313220,NARROW FABRIC MILLS AND SCHIFFLI MACHINE EMBROIDERY,man_lgt,3133,21,man_lgt,MWTEMPN
187,313230,NONWOVEN FABRIC MILLS,man_lgt,3133,21,man_lgt,MWTEMPN
188,313240,KNIT FABRIC MILLS,man_lgt,3133,21,man_lgt,MWTEMPN
189,313310,TEXTILE AND FABRIC FINISHING MILLS,man_lgt,3133,21,man_lgt,MWTEMPN
190,313320,FABRIC COATING MILLS,man_lgt,3133,21,man_lgt,MWTEMPN
191,314110,CARPET AND RUG MILLS,man_lgt,3133,22,man_lgt,MWTEMPN
192,314120,CURTAIN AND LINEN MILLS,man_lgt,3133,22,man_lgt,MWTEMPN
193,314910,TEXTILE BAG AND CANVAS MILLS,man_lgt,3133,22,man_lgt,MWTEMPN
194,314994,"ROPE, CORDAGE, TWINE, TIRE CORD, AND TIRE FABRIC MILLS",man_lgt,3133,22,man_lgt,MWTEMPN
195,314999,ALL OTHER MISCELLANEOUS TEXTILE PRODUCT MILLS,man_lgt,3133,22,man_lgt,MWTEMPN
196,315110,HOSIERY AND SOCK MILLS,man_lgt,3133,23,man_lgt,MWTEMPN
197,315190,OTHER APPAREL KNITTING MILLS,man_lgt,3133,23,man_lgt,MWTEMPN
198,315210,CUT AND SEW APPAREL CONTRACTORS,man_lgt,3133,23,man_lgt,MWTEMPN
199,315220,MEN'S AND BOYS' CUT AND SEW APPAREL MANUFACTURING,man_lgt,3133,23,man_lgt,MWTEMPN
200,315240,"WOMEN'S, GIRLS', AND INFANTS' CUT AND SEW APPAREL MANUFACTURING",man_lgt,3133,23,man_lgt,MWTEMPN
201,315280,OTHER CUT AND SEW APPAREL MANUFACTURING,man_lgt,3133,23,man_lgt,MWTEMPN
202,315990,APPAREL ACCESSORIES AND OTHER APPAREL MANUFACTURING,man_lgt,3133,23,man_lgt,MWTEMPN
203,316110,LEATHER AND HIDE TANNING AND FINISHING,man_lgt,3133,24,man_lgt,MWTEMPN
204,316210,FOOTWEAR MANUFACTURING,man_lgt,3133,24,man_lgt,MWTEMPN
205,316992,WOMEN'S HANDBAG AND PURSE MANUFACTURING,man_lgt,3133,24,man_lgt,MWTEMPN
206,316998,ALL OTHER LEATHER GOOD AND ALLIED PRODUCT MANUFACTURING,man_lgt,3133,24,man_lgt,MWTEMPN
207,321113,SAWMILLS,man_lgt,3133,8,man_hvy,MWTEMPN
208,321114,WOOD PRESERVATION,man_lgt,3133,8,man_hvy,MWTEMPN
209,321211,HARDWOOD VENEER AND PLYWOOD MANUFACTURING,man_lgt,3133,8,man_hvy,MWTEMPN
210,321212,SOFTWOOD VENEER AND PLYWOOD MANUFACTURING,man_lgt,3133,8,man_hvy,MWTEMPN
211,321213,ENGINEERED WOOD MEMBER (EXCEPT TRUSS) MANUFACTURING,man_lgt,3133,8,man_hvy,MWTEMPN
212,321214,TRUSS MANUFACTURING,man_lgt,3133,8,man_hvy,MWTEMPN
213,321219,RECONSTITUTED WOOD PRODUCT MANUFACTURING,man_lgt,3133,8,man_hvy,MWTEMPN
214,321911,WOOD WINDOW AND DOOR MANUFACTURING,man_lgt,3133,8,man_hvy,MWTEMPN
215,321912,"CUT STOCK, RESAWING LUMBER, AND PLANING",man_lgt,3133,8,man_hvy,MWTEMPN
216,321918,OTHER MILLWORK (INCLUDING FLOORING),man_lgt,3133,8,man_hvy,MWTEMPN
217,321920,WOOD CONTAINER AND PALLET MANUFACTURING,man_lgt,3133,8,man_hvy,MWTEMPN
218,321991,MANUFACTURED HOME (MOBILE HOME)  MANUFACTURING,man_lgt,3133,8,man_hvy,MWTEMPN
219,321992,PREFABRICATED WOOD BUILDING MANUFACTURING,man_lgt,3133,8,man_hvy,MWTEMPN
220,321999,ALL OTHER MISCELLANEOUS WOOD PRODUCT MANUFACTURING,man_lgt,3133,8,man_hvy,MWTEMPN
221,322110,PULP MILLS,man_hvy,3133,25,man_hvy,MWTEMPN
222,322121,PAPER (EXCEPT NEWSPRINT) MILLS,man_hvy,3133,25,man_hvy,MWTEMPN
223,322122,NEWSPRINT MILLS,man_hvy,3133,25,man_hvy,MWTEMPN
224,322130,PAPERBOARD MILLS,man_hvy,3133,25,man_hvy,MWTEMPN
225,322211,CORRUGATED AND SOLID FIBER BOX MANUFACTURING,man_lgt,3133,25,man_hvy,MWTEMPN
226,322212,FOLDING PAPERBOARD BOX MANUFACTURING,man_lgt,3133,25,man_hvy,MWTEMPN
227,322219,OTHER PAPERBOARD CONTAINER MANUFACTURING,man_lgt,3133,25,man_hvy,MWTEMPN
228,322220,PAPER BAG AND COATED AND TREATED PAPER MANUFACTURING,man_lgt,3133,25,man_hvy,MWTEMPN
229,322230,STATIONERY PRODUCT MANUFACTURING,man_lgt,3133,25,man_hvy,MWTEMPN
230,322291,SANITARY PAPER PRODUCT MANUFACTURING,man_lgt,3133,25,man_hvy,MWTEMPN
231,322299,ALL OTHER CONVERTED PAPER PRODUCT MANUFACTURING,man_lgt,3133,25,man_hvy,MWTEMPN
232,323111,COMMERCIAL PRINTING (EXCEPT SCREEN AND BOOKS),man_lgt,3133,26,man_hvy,MWTEMPN
233,323113,COMMERCIAL SCREEN PRINTING,man_lgt,3133,26,man_hvy,MWTEMPN
234,323117,BOOK PRINTING,man_lgt,3133,26,man_hvy,MWTEMPN
235,323120,SUPPORT ACTIVITIES FOR PRINTING,man_lgt,3133,26,man_hvy,MWTEMPN
236,324110,PETROLEUM REFINERIES,man_lgt,3133,27,man_hvy,MWTEMPN
237,324121,ASPHALT PAVING MIXTURE AND BLOCK MANUFACTURING,man_lgt,3133,27,man_hvy,MWTEMPN
238,324122,ASPHALT SHINGLE AND COATING MATERIALS MANUFACTURING,man_lgt,3133,27,man_hvy,MWTEMPN
239,324191,PETROLEUM LUBRICATING OIL AND GREASE MANUFACTURING,man_lgt,3133,27,man_hvy,MWTEMPN
240,324199,ALL OTHER PETROLEUM AND COAL PRODUCTS MANUFACTURING,man_lgt,3133,27,man_hvy,MWTEMPN
241,325110,PETROCHEMICAL MANUFACTURING,man_lgt,3133,28,man_hvy,MWTEMPN
242,325120,INDUSTRIAL GAS MANUFACTURING,man_lgt,3133,28,man_hvy,MWTEMPN
243,325130,SYNTHETIC DYE AND PIGMENT MANUFACTURING,man_lgt,3133,28,man_hvy,MWTEMPN
244,325180,ALL OTHER BASIC INORGANIC CHEMICAL MANUFACTURING,man_lgt,3133,28,man_hvy,MWTEMPN
245,325193,ETHYL ALCOHOL MANUFACTURING,man_lgt,3133,28,man_hvy,MWTEMPN
246,325194,"CYCLIC CRUDE, INTERMEDIATE, AND GUM AND WOOD CHEMICAL MANUFACTURING",man_lgt,3133,28,man_hvy,MWTEMPN
247,325199,ALL OTHER BASIC ORGANIC CHEMICAL MANUFACTURING,man_lgt,3133,28,man_hvy,MWTEMPN
248,325211,PLASTICS MATERIAL AND RESIN MANUFACTURING,man_lgt,3133,28,man_hvy,MWTEMPN
249,325212,SYNTHETIC RUBBER MANUFACTURING,man_lgt,3133,28,man_hvy,MWTEMPN
250,325220,ARTIFICIAL AND SYNTHETIC FIBERS AND FILAMENTS MANUFACTURING,man_lgt,3133,28,man_hvy,MWTEMPN
251,325311,NITROGENOUS FERTILIZER MANUFACTURING,man_lgt,3133,28,man_hvy,MWTEMPN
252,325312,PHOSPHATIC FERTILIZER MANUFACTURING,man_lgt,3133,28,man_hvy,MWTEMPN
253,325314,FERTILIZER (MIXING ONLY) MANUFACTURING,man_lgt,3133,28,man_hvy,MWTEMPN
254,325320,PESTICIDE AND OTHER AGRICULTURAL CHEMICAL MANUFACTURING,man_lgt,3133,28,man_hvy,MWTEMPN
255,325411,MEDICINAL AND BOTANICAL MANUFACTURING,man_bio,3133,28,man_tech,MWTEMPN
256,325412,PHARMACEUTICAL PREPARATION MANUFACTURING,man_bio,3133,28,man_tech,MWTEMPN
257,325413,IN-VITRO DIAGNOSTIC SUBSTANCE MANUFACTURING,man_bio,3133,28,man_tech,MWTEMPN
258,325414,BIOLOGICAL PRODUCT (EXCEPT DIAGNOSTIC) MANUFACTURING,man_bio,3133,28,man_tech,MWTEMPN
259,325510,PAINT AND COATING MANUFACTURING,man_lgt,3133,28,man_hvy,MWTEMPN
260,325520,ADHESIVE MANUFACTURING,man_lgt,3133,28,man_hvy,MWTEMPN
261,325611,SOAP AND OTHER DETERGENT MANUFACTURING,man_lgt,3133,28,man_hvy,MWTEMPN
262,325612,POLISH AND OTHER SANITATION GOOD MANUFACTURING,man_lgt,3133,28,man_hvy,MWTEMPN
263,325613,SURFACE ACTIVE AGENT MANUFACTURING,man_lgt,3133,28,man_hvy,MWTEMPN
264,325620,TOILET PREPARATION MANUFACTURING,man_lgt,3133,28,man_hvy,MWTEMPN
265,325910,PRINTING INK MANUFACTURING,man_lgt,3133,28,man_hvy,MWTEMPN
266,325920,EXPLOSIVES MANUFACTURING,man_lgt,3133,28,man_hvy,MWTEMPN
267,325991,CUSTOM COMPOUNDING OF PURCHASED RESIN,man_lgt,3133,28,man_hvy,MWTEMPN
268,325992,"PHOTOGRAPHIC FILM, PAPER, PLATE AND CHEMICAL MANUFACTURING",man_lgt,3133,28,man_hvy,MWTEMPN
269,325998,ALL OTHER MISCELLANEOUS CHEMICAL PRODUCT AND PREPARATION MANUFACTURING,man_lgt,3133,28,man_hvy,MWTEMPN
270,326111,UNSUPPORTED PLASTICS BAG MANUFACTURING,man_lgt,3133,29,man_hvy,MWTEMPN
271,326112,UNSUPPORTED PLASTICS PACKAGING FILM AND SHEET MANUFACTURING,man_lgt,3133,29,man_hvy,MWTEMPN
272,326113,UNSUPPORTED PLASTICS FILM AND SHEET (EXCEPT PACKAGING) MANUFACTURING,man_lgt,3133,29,man_hvy,MWTEMPN
273,326121,UNSUPPORTED PLASTICS PROFILE SHAPE MANUFACTURING,man_lgt,3133,29,man_hvy,MWTEMPN
274,326122,PLASTICS PIPE AND  PIPE FITTING MANUFACTURING,man_lgt,3133,29,man_hvy,MWTEMPN
275,326130,"LAMINATED PLASTICS PLATE, SHEET, AND SHAPE MANUFACTURING",man_lgt,3133,29,man_hvy,MWTEMPN
276,326140,POLYSTYRENE FOAM PRODUCT MANUFACTURING,man_lgt,3133,29,man_hvy,MWTEMPN
277,326150,URETHANE AND OTHER FOAM PRODUCT (EXCEPT POLYSTYRENE) MANUFACTURING,man_lgt,3133,29,man_hvy,MWTEMPN
278,326160,PLASTICS BOTTLE MANUFACTURING,man_lgt,3133,29,man_hvy,MWTEMPN
279,326191,PLASTICS PLUMBING FIXTURES MANUFACTURING,man_lgt,3133,29,man_hvy,MWTEMPN
280,326199,ALL OTHER PLASTICS PRODUCT MANUFACTURING,man_lgt,3133,29,man_hvy,MWTEMPN
281,326211,TIRE MANUFACTURING (EXCEPT RETREADING),man_lgt,3133,29,man_hvy,MWTEMPN
282,326212,TIRE RETREADING,man_lgt,3133,29,man_hvy,MWTEMPN
283,326220,RUBBER AND PLASTICS HOSES AND BELTING MANUFACTURING,man_lgt,3133,29,man_hvy,MWTEMPN
284,326291,RUBBER PRODUCT MANUFACTURING FOR MECHANICAL USE,man_lgt,3133,29,man_hvy,MWTEMPN
285,326299,ALL OTHER RUBBER PRODUCT MANUFACTURING,man_lgt,3133,29,man_hvy,MWTEMPN
286,327110,"POTTERY, CERAMICS, AND PLUMBING FIXTURE MANUFACTURING",man_lgt,3133,9,man_hvy,MWTEMPN
287,327120,CLAY BUILDING MATERIAL AND REFRACTORIES MANUFACTURING,man_lgt,3133,9,man_hvy,MWTEMPN
288,327211,FLAT GLASS MANUFACTURING,man_lgt,3133,9,man_hvy,MWTEMPN
289,327212,OTHER PRESSED AND BLOWN GLASS AND GLASSWARE MANUFACTURING,man_lgt,3133,9,man_hvy,MWTEMPN
290,327213,GLASS CONTAINER MANUFACTURING,man_lgt,3133,9,man_hvy,MWTEMPN
291,327215,GLASS PRODUCT MANUFACTURING MADE OF PURCHASED GLASS,man_lgt,3133,9,man_hvy,MWTEMPN
292,327310,CEMENT MANUFACTURING,man_lgt,3133,9,man_hvy,MWTEMPN
293,327320,READY-MIX CONCRETE MANUFACTURING,man_lgt,3133,9,man_hvy,MWTEMPN
294,327331,CONCRETE BLOCK AND BRICK MANUFACTURING,man_lgt,3133,9,man_hvy,MWTEMPN
295,327332,CONCRETE PIPE MANUFACTURING,man_lgt,3133,9,man_hvy,MWTEMPN
296,327390,OTHER CONCRETE PRODUCT MANUFACTURING,man_lgt,3133,9,man_hvy,MWTEMPN
297,327410,LIME MANUFACTURING,man_lgt,3133,9,man_hvy,MWTEMPN
298,327420,GYPSUM AND GYPSUM PRODUCT MANUFACTURING,man_lgt,3133,9,man_hvy,MWTEMPN
299,327910,ABRASIVE PRODUCT MANUFACTURING,man_lgt,3133,9,man_hvy,MWTEMPN
300,327991,CUT STONE AND STONE PRODUCT MANUFACTURING,man_lgt,3133,9,man_hvy,MWTEMPN
301,327992,GROUND OR TREATED MINERAL AND EARTH MANUFACTURING,man_lgt,3133,9,man_hvy,MWTEMPN
302,327993,MINERAL WOOL MANUFACTURING,man_lgt,3133,9,man_hvy,MWTEMPN
303,327999,ALL OTHER MISCELLANEOUS NONMETALLIC MINERAL PRODUCT MANUFACTURING,man_lgt,3133,9,man_hvy,MWTEMPN
304,331110,IRON AND STEEL MILLS AND FERROALLY MANUFACTURING,man_hvy,3133,10,man_hvy,MWTEMPN
305,331210,IRON AND STEEL PIPES AND TUBES MANUFACTURING FROM PURCHASED STEEL,man_hvy,3133,10,man_hvy,MWTEMPN
306,331221,ROLLED STEEL SHAPE MANUFACTURING,man_hvy,3133,10,man_hvy,MWTEMPN
307,331222,STEEL WIRE DRAWING,man_hvy,3133,10,man_hvy,MWTEMPN
308,331313,ALUMINUM PRODUCTION AND MANUFACTURING ALUMINUM ALLOY,man_hvy,3133,10,man_hvy,MWTEMPN
309,331314,SECONDARY SMELTING AND ALLOYING OF ALUMINUM,man_hvy,3133,10,man_hvy,MWTEMPN
310,331315,"ALUMINUM SHEET, PLATE, AND FOIL MANUFACTURING",man_hvy,3133,10,man_hvy,MWTEMPN
311,331318,"OTHER ALUMINUM ROLLING, DRAWING, AND EXTRUDING",man_hvy,3133,10,man_hvy,MWTEMPN
312,331410,NONFERROUS METAL (EXCEPT ALUMINUM) SMELTING AND REFINING,man_hvy,3133,10,man_hvy,MWTEMPN
313,331420,"COPPER ROLLING, DRAWING, EXTRUDING, AND ALLOYING",man_hvy,3133,10,man_hvy,MWTEMPN
314,331491,"NONFERROUS METAL (EXCEPT COPPER AND ALUMINUM) ROLLING. DRAWING, AND EXTRUDING",man_hvy,3133,10,man_hvy,MWTEMPN
315,331492,"SECONDARY SMELTING, REFINING, AND ALLOYING OF NONFERROUS METALS (EXCEPT COPPER AND ALUMINUM)",man_hvy,3133,10,man_hvy,MWTEMPN
316,331511,IRON FOUNDRIES,man_hvy,3133,10,man_hvy,MWTEMPN
317,331512,STEEL INVESTMENT FOUNDRIES,man_hvy,3133,10,man_hvy,MWTEMPN
318,331513,STEEL FOUNDRIES (EXCEPT INVESTMENT),man_hvy,3133,10,man_hvy,MWTEMPN
319,331523,NONFERROUS METAL DIE-CASTING FOUNDRIES,man_hvy,3133,10,man_hvy,MWTEMPN
320,331524,ALUMINUM FOUNDRIES (EXCEPT DIE-CASTING),man_hvy,3133,10,man_hvy,MWTEMPN
321,331529,OTHER NONFERROUS METAL FOUNDRIES (EXCEPT DIE-CASTING),man_hvy,3133,10,man_hvy,MWTEMPN
322,332111,IRON AND STEEL FORGING,man_lgt,3133,11,man_hvy,MWTEMPN
323,332112,NONFERROUS FORGING,man_lgt,3133,11,man_hvy,MWTEMPN
324,332114,CUSTOM ROLL FORMING,man_lgt,3133,11,man_hvy,MWTEMPN
325,332117,POWDER METALLURGY PART MANUFACTURING,man_lgt,3133,11,man_hvy,MWTEMPN
326,332119,"METAL CROWN, CLOSURE, AND OTHER METAL STAMPING (EXCEPT AUTOMOTIVE)",man_lgt,3133,11,man_hvy,MWTEMPN
327,332215,"METAL KITCHEN COOKWARE, UTENSIL, CUTLERY, AND FLATWARE (EXCEPT PRECIOUS) MANUFACTURING",man_lgt,3133,11,man_hvy,MWTEMPN
328,332216,SAW BLADE AND HANDTOOL MANUFACTURING,man_lgt,3133,11,man_hvy,MWTEMPN
329,332311,PREFABRICATED METAL BUILDING AND COMPONENT MANUFACTURING,man_lgt,3133,11,man_hvy,MWTEMPN
330,332312,FABRICATED STRUCTURAL METAL MANUFACTURING,man_lgt,3133,11,man_hvy,MWTEMPN
331,332313,PLATE WORK MANUFACTURING,man_lgt,3133,11,man_hvy,MWTEMPN
332,332321,METAL WINDOW AND DOOR MANUFACTURING,man_lgt,3133,11,man_hvy,MWTEMPN
333,332322,SHEET METAL WORK MANUFACTURING,man_lgt,3133,11,man_hvy,MWTEMPN
334,332323,ORNAMENTAL AND ARCHITECTURAL METAL WORK MANUFACTURING,man_lgt,3133,11,man_hvy,MWTEMPN
335,332410,POWER BOILER AND HEAT EXCHANGER MANUFACTURING,man_lgt,3133,11,man_hvy,MWTEMPN
336,332420,METAL TANK (HEAVY GAUGE) MANUFACTURING,man_lgt,3133,11,man_hvy,MWTEMPN
337,332431,METAL CAN MANUFACTURING,man_lgt,3133,11,man_hvy,MWTEMPN
338,332439,OTHER METAL CONTAINER MANUFACTURING,man_lgt,3133,11,man_hvy,MWTEMPN
339,332510,HARDWARE MANUFACTURING,man_lgt,3133,11,man_hvy,MWTEMPN
340,332613,SPRING MANUFACTURING,man_lgt,3133,11,man_hvy,MWTEMPN
341,332618,OTHER FABRICATED WIRE PRODUCT MANUFACTURING,man_lgt,3133,11,man_hvy,MWTEMPN
342,332710,MACHINE SHOPS,man_lgt,3133,11,man_hvy,MWTEMPN
343,332721,PRECISION TURNED PRODUCT MANUFACTURING,man_lgt,3133,11,man_hvy,MWTEMPN
344,332722,"BOLT, NUT, SCREW, RIVET, AND WASHER MANUFACTURING",man_lgt,3133,11,man_hvy,MWTEMPN
345,332811,METAL HEAT TREATING,man_lgt,3133,11,man_hvy,MWTEMPN
